{
  "schema_version": 1,
  "workspace_id": "adopted-example",
  "default_sensitivity": "internal",
  "adopted_task_paths": [
    "Existing Projects/Research α"
  ],
  "adopted_material_roots": [
    {
      "path": "Reference Library/共享资料",
      "sensitivity": "public"
    },
    {
      "path": "Reference Library/共享资料/受限",
      "sensitivity": "restricted"
    }
  ],
  "exclude_paths": [
    "Existing Projects/Nested Repository",
    "Private Drop"
  ]
}
